{
  "$schema": "https://json-schema.org/draft/2020-12/schema",
  "$id": "https://unpkg.com/arkgate/schemas/ark.arkrules.schema.json",
  "title": "ArkGate ArkRules (intra-layer contract)",
  "description": "Per-layer structure sensors and invariant catalog consumed by the ArkGate Effective Contract.",
  "type": "object",
  "additionalProperties": false,
  "required": [
    "schemaVersion",
    "layer"
  ],
  "properties": {
    "$schema": {
      "type": "string",
      "minLength": 1,
      "default": "https://unpkg.com/arkgate/schemas/ark.arkrules.schema.json"
    },
    "schemaVersion": {
      "type": "string",
      "const": "1.0",
      "default": "1.0"
    },
    "layer": {
      "type": "string",
      "minLength": 1
    },
    "structure": {
      "type": "array",
      "default": [],
      "items": {
        "$ref": "#/$defs/structureEntry"
      }
    },
    "invariants": {
      "type": "array",
      "default": [],
      "items": {
        "$ref": "#/$defs/invariantEntry"
      }
    }
  },
  "$defs": {
    "structureEntry": {
      "type": "object",
      "additionalProperties": false,
      "required": [
        "id",
        "sensor"
      ],
      "properties": {
        "id": {
          "type": "string",
          "minLength": 1
        },
        "sensor": {
          "type": "string",
          "enum": [
            "aggregate-private-state",
            "always-valid-factory",
            "domain-event-on-mutation",
            "orchestration-only",
            "thin-adapter",
            "writes-via-aggregate",
            "no-anemic-model",
            "invariant-coverage"
          ]
        },
        "mode": {
          "type": "string",
          "enum": [
            "advisory",
            "enforced"
          ],
          "default": "advisory"
        },
        "appliesTo": {
          "type": "array",
          "items": {
            "type": "string",
            "minLength": 1
          },
          "uniqueItems": true
        },
        "description": {
          "type": "string",
          "minLength": 1
        }
      }
    },
    "invariantEntry": {
      "type": "object",
      "additionalProperties": false,
      "required": [
        "id",
        "description"
      ],
      "properties": {
        "id": {
          "type": "string",
          "minLength": 1
        },
        "description": {
          "type": "string",
          "minLength": 1
        },
        "aggregate": {
          "type": "string",
          "minLength": 1
        },
        "coverage": {
          "type": "object",
          "additionalProperties": false,
          "properties": {
            "test": {
              "type": "boolean"
            },
            "symbol": {
              "type": "string",
              "minLength": 1
            }
          }
        },
        "mode": {
          "type": "string",
          "enum": [
            "advisory",
            "enforced"
          ],
          "default": "advisory"
        },
        "appliesTo": {
          "type": "array",
          "items": {
            "type": "string",
            "minLength": 1
          },
          "uniqueItems": true
        }
      }
    }
  }
}
