{
  "$schema": "https://unpkg.com/arkgate/schemas/ark.arkrules.schema.json",
  "schemaVersion": "1.0",
  "layer": "ApplicationOrchestration",
  "structure": [
    {
      "id": "writes-via-aggregate",
      "sensor": "writes-via-aggregate",
      "mode": "enforced",
      "appliesTo": [
        "src/lib/features/a/**",
        "src/lib/features/b/**",
        "src/lib/features/c/**"
      ],
      "description": "A use case does not write a table. The aggregate and the adapter do."
    }
  ],
  "invariants": []
}
