{
  "$schema": "https://unpkg.com/arkgate/schemas/ark.arkrules.schema.json",
  "schemaVersion": "1.0",
  "layer": "DomainModel",
  "structure": [
    {
      "id": "always-valid-aggregates",
      "sensor": "aggregate-private-state",
      "mode": "advisory",
      "description": "Aggregates keep state private; mutate through methods."
    },
    {
      "id": "always-valid-factory",
      "sensor": "always-valid-factory",
      "mode": "advisory",
      "description": "Prefer private constructors with static factories for aggregates."
    },
    {
      "id": "events-on-mutation",
      "sensor": "domain-event-on-mutation",
      "mode": "advisory",
      "description": "Domain mutations should guard invariants or publish events."
    },
    {
      "id": "no-anemic-model",
      "sensor": "no-anemic-model",
      "mode": "advisory",
      "description": "Prefer rich domain types over data-only bags (advisory only)."
    }
  ],
  "invariants": []
}
