{
  "$schema": "https://unpkg.com/arkgate/schemas/ark.arkrules.schema.json",
  "schemaVersion": "1.0",
  "layer": "PresentationAdapters",
  "structure": [
    {
      "id": "thin-presentation-adapter",
      "sensor": "thin-adapter",
      "mode": "advisory",
      "description": "Adapters stay thin: map I/O and delegate; avoid domain branching + persistence here."
    }
  ],
  "invariants": []
}
